entity,records_lost,year,story,domain,method,sensitivity,source,link1,link2,records_lost_bins,month,date,story_clean,story_no_stopwords,story_no_stopwords_lem,rake,tdidf_ranked,org_type,business_type,sensitivity_log,severity,severity_bins,symbol
toyota,3100000,2019,The personal information of roughly 3.1 million Toyota customers may have been leaked following a security breach of multiple Toyota and Lexus sales subsidiaries.,transport,technical,2.0,bleeping computer,https://www.bleepingcomputer.com/news/security/toyota-security-breach-exposes-personal-info-of-31-million-clients/,https://global.toyota/jp/newsroom/corporate/27465617.html,3,Apr,2019-04-01,the personal information of roughly  million toyota customers may have been leaked following a security breach of multiple toyota and lexus sales subsidiaries,"personal,information,roughly,million,customers,may,leaked,following,security,breach,multiple,lexus,sales,subsidiaries","personal,information,roughly,million,customer,may,leaked,following,security,breach,multiple,lexus,sale,subsidiary",personal information roughly million customer may leaked following security breach multiple lexus sale subsidiary,"lexus,subsidiary,multiple,roughly,following,sale,leaked,breach,customer,personal,security,information,million",infrastructure,integrity,10.0,31000000.0,3.0,TM
gett,1800000,2019,"Ge.tt was part of the theft of 127 million records from eight websites, by the same hacker who previously stole 617 million online account details from 16 other sites. All were put up for sale on the dark web.",web,technical,1.0,techcrunch,https://techcrunch.com/2019/02/14/hacker-strikes-again/,,3,Feb,2019-02-01,gett was part of the theft of  million records from eight websites by the same hacker who previously stole  million online account details from  other sites all were put up for sale on the dark web,"part,theft,million,records,eight,websites,hacker,previously,stole,million,online,account,details,sites,put,sale,dark,web","part,theft,million,record,eight,website,hacker,previously,stole,million,online,account,detail,site,put,sale,dark,web",part theft million record eight website hacker previously stole million online account detail site put sale dark web,"million,previously,dark,sale,stole,site,theft,web,website,online,record,account,hacker",tech,innovators,1.0,1800000.0,2.0,GTY
google,52500000,2018,"A new vulnerability could have exposed users' personal details to developers, even if their profiles were set to private. Google will now shut down the consumer version of the social network 4 months earlier than planned. ",web,human,2.0,the verge,https://www.theverge.com/2018/12/10/18134541/google-plus-privacy-api-data-leak-developers,,4,Dec,2018-12-01,a new vulnerability could have exposed users personal details to developers even if their profiles were set to private google will now shut down the consumer version of the social network  months earlier than planned ,"new,vulnerability,could,exposed,users,personal,details,developers,even,profiles,set,private,shut,consumer,version,social,network,months,earlier,planned","new,vulnerability,could,exposed,user,personal,detail,developer,even,profile,set,private,shut,consumer,version,social,network,month,earlier,planned",new vulnerability could exposed user personal detail developer even profile set private shut consumer version social network month earlier planned,"earlier,planned,shut,profile,set,version,consumer,developer,vulnerability,new,month,private,network,exposed,social,user,personal",tech,innovators,10.0,525000000.0,4.0,GOOG
facebook,50000000,2018,"Cambridge Analytica, headed at the time by Steve Bannon, harvested 50m profiles in early 2014 to build a system that could profile US voters and target them with political adverts. ",web,technical,1.0,guardian,https://www.theguardian.com/news/2018/mar/17/cambridge-analytica-facebook-influence-us-election?CMP=twt_gu,,4,Mar,2018-03-01,cambridge analytica headed at the time by steve bannon harvested m profiles in early  to build a system that could profile us voters and target them with political adverts ,"cambridge,analytica,headed,time,steve,bannon,harvested,profiles,early,build,system,could,profile,us,voters,political,adverts","cambridge,analytica,headed,time,steve,bannon,harvested,profile,early,build,system,could,profile,u,voter,political,advert",cambridge analytica headed time steve bannon harvested profile early build system could profile u voter political advert,"profile,advert,analytica,bannon,build,cambridge,harvested,headed,steve,early,political,time,voter",tech,innovators,1.0,50000000.0,3.0,FB
grindr,3000000,2018,"A third-party tool that allows users to see who blocked them on Grindr was able to access non-public personal info, including exact locations of users who had opted out of location sharing. ",app,human,3.0,nbc news,https://www.nbcnews.com/feature/nbc-out/security-flaws-gay-dating-app-grindr-expose-users-location-data-n858446,,3,Mar,2018-03-01,a thirdparty tool that allows users to see who blocked them on grindr was able to access nonpublic personal info including exact locations of users who had opted out of location sharing ,"thirdparty,tool,allows,users,see,blocked,able,access,nonpublic,personal,info,including,exact,locations,users,opted,location,sharing","thirdparty,tool,allows,user,see,blocked,able,access,nonpublic,personal,info,including,exact,location,user,opted,location,sharing",thirdparty tool allows user see blocked able access nonpublic personal info including exact location user opted location sharing,"location,allows,blocked,exact,nonpublic,opted,sharing,user,thirdparty,tool,able,info,access,including,personal",tech,innovators,100.0,300000000.0,4.0,GRIN
twitter,330000000,2018,"A glitch caused some passwords to be stored in readable text, visible on the internal computer system. ",app,human,1.0,reuters,https://www.reuters.com/article/us-twitter-passwords/twitter-urges-all-users-to-change-passwords-after-glitch-idUSKBN1I42JG,,5,May,2018-05-01,a glitch caused some passwords to be stored in readable text visible on the internal computer system ,"glitch,caused,passwords,stored,readable,text,visible,internal,computer,system","glitch,caused,password,stored,readable,text,visible,internal,computer,system",glitch caused password stored readable text visible internal computer system,"glitch,readable,visible,caused,text,internal,stored,computer,password",tech,innovators,1.0,330000000.0,4.0,TWTR
amazon,5000000,2018,Customer names & email addresses were disclosed on its website. Amazon hasn't confirmed how many records were exposed. ,retail,human,1.0,guardian,https://www.theguardian.com/technology/2018/nov/21/amazon-hit-with-major-data-breach-days-before-black-friday,,3,Nov,2018-11-01,customer names & email addresses were disclosed on its website amazon hasnt confirmed how many records were exposed ,"customer,names,&,email,addresses,disclosed,website,hasnt,confirmed,many,records,exposed","customer,name,&,email,address,disclosed,website,hasnt,confirmed,many,record,exposed","email address disclosed website hasnt confirmed many record exposed,customer name","disclosed,confirmed,exposed,website,customer,record,email,address",retail,realworld,1.0,5000000.0,2.0,AMZN
amazon,100000,2018,"Customer names and email addresses accidentally disclosed on its website, just two days ahead of Black Friday. No of users affected not released.",tech,human,1.0,the guardian,https://amp.theguardian.com/technology/2018/nov/21/amazon-hit-with-major-data-breach-days-before-black-friday,,1,Nov,2018-11-01,customer names and email addresses accidentally disclosed on its website just two days ahead of black friday no of users affected not released,"customer,names,email,addresses,accidentally,disclosed,website,two,days,ahead,black,friday,users,affected,released","customer,name,email,address,accidentally,disclosed,website,two,day,ahead,black,friday,user,affected,released",customer name email address accidentally disclosed website two day ahead black friday user affected released,"ahead,friday,black,accidentally,day,disclosed,released,affected,website,user,customer,email,address",tech,innovators,1.0,100000.0,0.0,AMZN
dell,100000,2018,"Dell detected & disrupted unauthorized activity on its network attempting to extract Dell customer information, which was included names, email addresses & hashed passwords",tech,technical,1.0,dell,https://www.dell.com/learn/us/en/uscorp1/press-releases/2018-11-28-customer-update,,1,Nov,2018-11-01,dell detected & disrupted unauthorized activity on its network attempting to extract dell customer information which was included names email addresses & hashed passwords,"detected,&,disrupted,unauthorized,activity,network,attempting,extract,customer,information,included,names,email,addresses,&,hashed,passwords","detected,&,disrupted,unauthorized,activity,network,attempting,extract,customer,information,included,name,email,address,&,hashed,password","disrupted unauthorized activity network attempting extract customer information included name email address,hashed password,detected","activity,attempting,disrupted,extract,detected,hashed,unauthorized,network,included,customer,password,email,information,address",tech,innovators,1.0,100000.0,0.0,DELL
cms,93689,2018,"CMS states that no protected health info, banking or tax details were breached, but personal info, insurance, income etc might have been exposed. ",healthcare,technical,2.0,hca news,https://www.hcanews.com/news/update-94k-hit-in-cms-data-breach,,1,Nov,2018-11-01,cms states that no protected health info banking or tax details were breached but personal info insurance income etc might have been exposed ,"states,protected,health,info,banking,tax,details,breached,personal,info,insurance,income,etc,might,exposed","state,protected,health,info,banking,tax,detail,breached,personal,info,insurance,income,etc,might,exposed",state protected health info banking tax detail breached personal info insurance income etc might exposed,"info,income,protected,banking,tax,insurance,state,breached,health,exposed,personal",healthcare,integrity,10.0,936890.0,1.0,CMS
facebook,29000000,2018,Malicious third-party scrapers collected profile information from many Facebook users. ,web,technical,2.0,business insider,https://www.businessinsider.com.au/facebook-thinks-spammers-responsible-hack-stole-info-from-29-million-users-2018-10?r=US&IR=T,https://newsroom.fb.com/news/2018/10/update-on-security-issue/,4,Oct,2018-10-01,malicious thirdparty scrapers collected profile information from many facebook users ,"malicious,thirdparty,scrapers,collected,profile,information,many,users","malicious,thirdparty,scraper,collected,profile,information,many,user",malicious thirdparty scraper collected profile information many user,"collected,scraper,profile,thirdparty,malicious,user,information",tech,innovators,10.0,290000000.0,4.0,FB
yahoo,32000000,2017,User accounts have been hacked using forged cookies to log in without a password over a 2 year period.,web,technical,4.0,cnet,https://www.cnet.com/news/yahoo-says-forged-cookie-attack-accessed-about-32m-accounts/,,4,Mar,2017-03-01,user accounts have been hacked using forged cookies to log in without a password over a  year period,"user,accounts,hacked,using,forged,cookies,log,without,password,year,period","user,account,hacked,using,forged,cooky,log,without,password,year,period",user account hacked using forged cooky log without password year period,"cooky,forged,log,period,using,year,hacked,user,account,password",tech,innovators,1000.0,32000000000.0,6.0,YHOO
bell,1900000,2017,Somebody claiming to be behind the attack has threatened Bell with more leaks if they don't cooporate. ,telecoms,technical,1.0,cbc,http://www.cbc.ca/beta/news/technology/bell-data-breach-customer-names-phone-numbers-emails-leak-1.4116608,,3,May,2017-05-01,somebody claiming to be behind the attack has threatened bell with more leaks if they dont cooporate ,"somebody,claiming,behind,attack,threatened,leaks,dont,cooporate","somebody,claiming,behind,attack,threatened,leak,dont,cooporate",somebody claiming behind attack threatened leak dont cooporate,"cooporate,dont,somebody,claiming,threatened,leak,attack",infrastructure,integrity,1.0,1900000.0,2.0,BLCM
viacom,3000000,2017,A misconfigured Amazon Web Server S3 cloud storage bucket was left wide open and public facing.,web,technical,4.0,the hacker news,https://thehackernews.com/2017/09/viacom-amazon-server.html,,3,Sep,2017-09-01,a misconfigured amazon web server s cloud storage bucket was left wide open and public facing,"misconfigured,web,server,cloud,storage,bucket,left,wide,open,public,facing","misconfigured,web,server,cloud,storage,bucket,left,wide,open,public,facing",misconfigured web server cloud storage bucket left wide open public facing,"bucket,facing,wide,cloud,misconfigured,open,public,left,storage,server,web",tech,innovators,1000.0,3000000000.0,5.0,VIAB
equifax,143000000,2017,"If you have a credit report, there’s a good chance that you’re one of the 143 million American consumers whose sensitive personal information was exposed in a data breach at Equifax, one of the nation’s three major credit reporting agencies.",financial,technical,4.0,uk gov,https://www.consumer.ftc.gov/blog/2017/09/equifax-data-breach-what-do,,5,Sep,2017-09-01,if you have a credit report there’s a good chance that you’re one of the  million american consumers whose sensitive personal information was exposed in a data breach at equifax one of the nation’s three major credit reporting agencies,"credit,report,there’s,good,chance,you’re,one,million,american,consumers,whose,sensitive,personal,information,exposed,data,breach,one,nation’s,major,credit,reporting,agencies","credit,report,there’s,good,chance,you’re,one,million,american,consumer,whose,sensitive,personal,information,exposed,data,breach,one,nation’s,major,credit,reporting,agency","one million american consumer whose sensitive personal information exposed data breach one nation ’,major credit reporting agency,’,credit report,good chance","credit,chance,good,nation,reporting,american,major,consumer,agency,report,sensitive,exposed,breach,personal,information,million,data",financial,integrity,1000.0,143000000000.0,7.0,EFX
yahoo,500000000,2016,"Happened in 2014, but no. records stolen was originally thought to be much smaller. Yahoo revealed the real numbers in 2016.",web,technical,2.0,business insider,http://uk.businessinsider.com/yahoo-hack-by-state-sponsored-actor-biggest-of-all-time-2016-9?r=US&IR=T,,5,Sep,2016-09-01,happened in  but no records stolen was originally thought to be much smaller yahoo revealed the real numbers in ,"happened,records,stolen,originally,thought,much,smaller,revealed,real,numbers","happened,record,stolen,originally,thought,much,smaller,revealed,real,number",happened record stolen originally thought much smaller revealed real number,"real,smaller,happened,originally,thought,revealed,record,stolen,number",tech,innovators,10.0,5000000000.0,5.0,YHOO
dropbox,68700000,2016,"User credentials were stolen in a 2012 hack, but the number affected has only just come to light. ",web,technical,1.0,the telegraph,http://www.telegraph.co.uk/technology/2016/08/31/dropbox-hackers-stole-70-million-passwords-and-email-addresses/,,4,Aug,2016-08-01,user credentials were stolen in a  hack but the number affected has only just come to light ,"user,credentials,stolen,hack,number,affected,come,light","user,credential,stolen,hack,number,affected,come,light",user credential stolen hack number affected come light,"come,light,credential,affected,hack,user,stolen,number",tech,innovators,1.0,68700000.0,3.0,DBX
vk,100544934,2016,"Over 100m user accounts were hacked and the data put up for sale online. A VK spokesperson has denied that the site was breached, claiming the data for sale is old details no longer in use.",web,technical,4.0,motherboard,http://motherboard.vice.com/read/another-day-another-hack-100-million-accounts-for-vk-russias-facebook,,5,Jun,2016-06-01,over m user accounts were hacked and the data put up for sale online a vk spokesperson has denied that the site was breached claiming the data for sale is old details no longer in use,"user,accounts,hacked,data,put,sale,online,spokesperson,denied,site,breached,claiming,data,sale,old,details,longer,use","user,account,hacked,data,put,sale,online,spokesperson,denied,site,breached,claiming,data,sale,old,detail,longer,use",user account hacked data put sale online spokesperson denied site breached claiming data sale old detail longer use,"sale,spokesperson,claiming,longer,denied,use,old,breached,data,site,online,hacked,user,account",tech,innovators,1000.0,100544934000.0,7.0,VKTXW
quest diagnostics,34000,2016,"The stolen data contained names, DOBs, lab results and some telephone numbers.",healthcare,technical,4.0,newsroom,http://newsroom.questdiagnostics.com/2016-12-12-Quest-Diagnostics-Provides-Notice-of-Data-Security-Incident#assets_129,,1,Dec,2016-12-01,the stolen data contained names dobs lab results and some telephone numbers,"stolen,data,contained,names,dobs,lab,results,telephone,numbers","stolen,data,contained,name,dobs,lab,result,telephone,number",stolen data contained name dobs lab result telephone number,"lab,dobs,result,telephone,contained,stolen,number,data",healthcare,integrity,1000.0,34000000.0,3.0,DGX
irs,100000,2015,"An unnamed cybermafia used an IRS app to download forms full of personal information. They posed as legitimate taxpayers, and tried to download forms on 200,000 people between February and May. They got away with half of them, the IRS said. The crooks used about 15,000 of them to claim tax refunds in other people's names.",government,technical,1.0,cnn,http://money.cnn.com/2015/05/26/pf/taxes/irs-website-data-hack/index.html,,1,May,2015-05-01,an unnamed cybermafia used an irs app to download forms full of personal information they posed as legitimate taxpayers and tried to download forms on  people between february and may they got away with half of them the irs said the crooks used about  of them to claim tax refunds in other peoples names,"unnamed,cybermafia,used,app,download,forms,full,personal,information,posed,legitimate,taxpayers,tried,download,forms,people,february,may,got,away,half,said,crooks,used,claim,tax,refunds,peoples,names","unnamed,cybermafia,used,app,download,form,full,personal,information,posed,legitimate,taxpayer,tried,download,form,people,february,may,got,away,half,said,crook,used,claim,tax,refund,people,name",unnamed cybermafia used app download form full personal information posed legitimate taxpayer tried download form people february may got away half said crook used claim tax refund people name,"form,download,people,used,crook,cybermafia,legitimate,posed,refund,taxpayer,away,unnamed,half,tried,february,got,app,tax,claim,said,personal,information",government,integrity,1.0,100000.0,0.0,IRS
anthem,80000000,2015,"Names, dates of birth, member ID/ social security numbers, addresses, phone numbers, email addresses and employment information.",healthcare,technical,2.0,nytimes,https://www.nytimes.com/2015/02/05/business/hackers-breached-data-of-millions-insurer-says.html,,4,Feb,2015-02-01,names dates of birth member id/ social security numbers addresses phone numbers email addresses and employment information,"names,dates,birth,member,id/,social,security,numbers,addresses,phone,numbers,email,addresses,employment,information","name,date,birth,member,id/,social,security,number,address,phone,number,email,address,employment,information","social security number address phone number email address employment information,name date birth member id","employment,address,number,member,id,phone,birth,date,social,email,security,information",healthcare,integrity,10.0,800000000.0,4.0,ANTM
community health systems,4500000,2014,"Community Health Systems, which operates 206 hospitals across the US, had patient data from the last 5 years breached. Details included names, addresses, social security numbers. Suspected chinese hackers were thought responsible. Goal: identity theft.",healthcare,technical,2.0,cnn,http://money.cnn.com/2014/08/18/technology/security/hospital-chs-hack/,,3,Aug,2014-08-01,community health systems which operates  hospitals across the us had patient data from the last  years breached details included names addresses social security numbers suspected chinese hackers were thought responsible goal: identity theft,"community,health,systems,operates,hospitals,across,us,patient,data,last,years,breached,details,included,names,addresses,social,security,numbers,suspected,chinese,hackers,thought,responsible,goal:,identity,theft","community,health,system,operates,hospital,across,u,patient,data,last,year,breached,detail,included,name,address,social,security,number,suspected,chinese,hacker,thought,responsible,goal:,identity,theft","community health system operates hospital across u patient data last year breached detail included name address social security number suspected chinese hacker thought responsible goal,identity theft","operates,community,goal,chinese,hospital,responsible,thought,suspected,identity,breached,year,patient,included,health,theft,social,hacker,security,address,number,data",healthcare,integrity,10.0,45000000.0,3.0,CYH
ebay,145000000,2014,The company has said hackers attacked between late February and early March with login credentials obtained from “a small number” of employees. They then accessed a database containing all user records and copied “a large part” of those credentials.,web,technical,1.0,business insider,https://www.businessinsider.com/cyber-thieves-took-data-on-145-million-ebay-customers-by-hacking-3-corporate-employees-2014-5?r=US&IR=T,,5,May,2014-05-01,the company has said hackers attacked between late february and early march with login credentials obtained from “a small number” of employees they then accessed a database containing all user records and copied “a large part” of those credentials,"company,said,hackers,attacked,late,february,early,march,login,credentials,obtained,“a,small,number”,employees,accessed,database,containing,user,records,copied,“a,large,part”,credentials","company,said,hacker,attacked,late,february,early,march,login,credential,obtained,“a,small,number”,employee,accessed,database,containing,user,record,copied,“a,large,part”,credential","company said hacker attacked late february early march login credential obtained “,small number ” employee accessed database containing user record copied “,large part ” credential","credential,small,early,attacked,copied,late,login,february,large,march,obtained,said,accessed,company,employee,containing,database,user,record,hacker,number",tech,innovators,1.0,145000000.0,4.0,EBAY
ups,4000000,2014,Malware was discovered in the credit & debit card processing systems at 51 branches in 24 states.,retail,technical,3.0,time,http://time.com/3151681/ups-hack/,,3,Aug,2014-08-01,malware was discovered in the credit & debit card processing systems at  branches in  states,"malware,discovered,credit,&,debit,card,processing,systems,branches,states","malware,discovered,credit,&,debit,card,processing,system,branch,state","debit card processing system branch state,malware discovered credit","branch,processing,malware,discovered,state,debit,credit,card",retail,realworld,100.0,400000000.0,4.0,UPS
home depot,56000000,2014,"Malware installed on cash register system across 2,200 stores syphoned credit card details of up to 56 million customers. May be the same group of Russian and Ukrainian hackers responsible for the data breaches at Target, Sally Beauty and P.F. Chang’s, among others",retail,technical,3.0,krebs on security,http://krebsonsecurity.com/2014/09/banks-credit-card-breach-at-home-depot/,,4,Sep,2014-09-01,malware installed on cash register system across  stores syphoned credit card details of up to  million customers may be the same group of russian and ukrainian hackers responsible for the data breaches at target sally beauty and pf chang’s among others,"malware,installed,cash,register,system,across,stores,syphoned,credit,card,details,million,customers,may,group,russian,ukrainian,hackers,responsible,data,breaches,sally,beauty,pf,chang’s,among,others","malware,installed,cash,register,system,across,store,syphoned,credit,card,detail,million,customer,may,group,russian,ukrainian,hacker,responsible,data,breach,sally,beauty,pf,chang’s,among,others","malware installed cash register system across store syphoned credit card detail million customer may group russian ukrainian hacker responsible data breach sally beauty pf chang ’,among others","beauty,chang,pf,sally,syphoned,cash,installed,register,ukrainian,responsible,russian,group,malware,store,breach,credit,card,customer,hacker,million,data",retail,realworld,100.0,5600000000.0,5.0,HD
