entity,records_lost,year,story,domain,method,sensitivity,source,link1,link2,records_lost_bins,month,date,story_clean,story_no_stopwords,story_no_stopwords_lem,rake,tdidf_ranked,org_type,business_type,sensitivity_log,severity,severity_bins,symbol
citigroup,150000,2013,"Third big data breach from Citigroup.The personal information of 150,000 consumers who went into bankruptcy between 2007 and 2011 – including their social security numbers – were exposed after Citi failed to properly redact court records before they were put on the Public Access to Court Electronic Records (PACER) system.",financial,human,2.0,softpedia,http://news.softpedia.com/news/Citi-Exposes-Details-of-150-000-Individuals-Who-Went-into-Bankruptcy-369979.shtml,,2,Jul,2013-07-01,third big data breach from citigroupthe personal information of  consumers who went into bankruptcy between  and  – including their social security numbers – were exposed after citi failed to properly redact court records before they were put on the public access to court electronic records (pacer) system,"third,big,data,breach,citigroupthe,personal,information,consumers,went,bankruptcy,–,including,social,security,numbers,–,exposed,citi,failed,properly,redact,court,records,put,public,access,court,electronic,records,(pacer),system","third,big,data,breach,citigroupthe,personal,information,consumer,went,bankruptcy,–,including,social,security,number,–,exposed,citi,failed,properly,redact,court,record,put,public,access,court,electronic,record,(pacer),system","third big data breach citigroupthe personal information consumer went bankruptcy – including social security number – exposed citi failed properly redact court record put public access court electronic record,system,pacer","court,bankruptcy,citi,citigroupthe,pacer,properly,redact,big,record,failed,electronic,public,consumer,went,exposed,breach,access,including,social,personal,security,information,number,data",financial,integrity,10.0,1500000.0,2.0,C
yahoo,1000000000,2013,"Happened in 2013 but only disclosed late 2016. Data included names, telephone numbers, DOBs, passwords and security questions. ",web,technical,2.0,ny times,http://www.nytimes.com/2016/12/14/technology/yahoo-hack.html?action=Click&contentCollection=BreakingNews&contentID=64651831&pgtype=Homepage&_r=0,,5,Dec,2013-12-01,happened in  but only disclosed late  data included names telephone numbers dobs passwords and security questions ,"happened,disclosed,late,data,included,names,telephone,numbers,dobs,passwords,security,questions","happened,disclosed,late,data,included,name,telephone,number,dobs,password,security,question",happened disclosed late data included name telephone number dobs password security question,"dobs,happened,late,question,telephone,disclosed,included,password,security,number,data",tech,innovators,10.0,10000000000.0,5.0,YHOO
twitter,250000,2013,"Hackers had access to limited user information -- usernames, email addresses, session tokens and encrypted/salted versions of passwords -- for approximately 250,000 users.",web,technical,1.0,cnn,https://edition.cnn.com/2013/02/01/tech/social-media/twitter-hacked/index.html,,2,Feb,2013-02-01,hackers had access to limited user information  usernames email addresses session tokens and encrypted/salted versions of passwords  for approximately  users,"hackers,access,limited,user,information,usernames,email,addresses,session,tokens,encrypted/salted,versions,passwords,approximately,users","hacker,access,limited,user,information,usernames,email,address,session,token,encrypted/salted,version,password,approximately,user","hacker access limited user information usernames email address session token encrypted,salted version password approximately user","limited,salted,session,token,user,approximately,version,encrypted,usernames,access,password,email,hacker,information,address",tech,innovators,1.0,250000.0,1.0,TWTR
apple,275000,2013,"Developer portal hacked. Some information about 275,000 3rd-party developers potentially stolen.","tech, web",technical,1.0,the guardian,http://www.guardian.co.uk/technology/2013/jul/22/apple-developer-site-hacked,,2,Jul,2013-07-01,developer portal hacked some information about  rdparty developers potentially stolen,"developer,portal,hacked,information,rdparty,developers,potentially,stolen","developer,portal,hacked,information,rdparty,developer,potentially,stolen",developer portal hacked information rdparty developer potentially stolen,"developer,rdparty,portal,potentially,hacked,stolen,information",tech,innovators,1.0,275000.0,1.0,AAPL
nasdaq,500000,2013,"Nasdaq forum website hacked by hacking ring, email addresses and passwords compromised",financial,technical,1.0,reuters,http://www.reuters.com/article/2013/07/18/net-us-nasdaq-cybercrime-website-idUSBRE96H1F520130718,,2,Jul,2013-07-01,nasdaq forum website hacked by hacking ring email addresses and passwords compromised,"forum,website,hacked,hacking,ring,email,addresses,passwords,compromised","forum,website,hacked,hacking,ring,email,address,password,compromised",forum website hacked hacking ring email address password compromised,"ring,forum,hacking,compromised,website,hacked,password,email,address",financial,integrity,1.0,500000.0,1.0,NDAQ
facebook,6000000,2013,"Using the network's Download Your Information tool, some Facebook members were inadvertently sent the phone numbers or email address of Facebook friends that were otherwise private. Facebook assured users that the bug was fixed within a day, and that there is no evidence that the information was used maliciously.",web,human,1.0,facebook,https://www.facebook.com/notes/facebook-security/important-message-from-facebooks-white-hat-program/10151437074840766,,3,Jun,2013-06-01,using the networks download your information tool some facebook members were inadvertently sent the phone numbers or email address of facebook friends that were otherwise private facebook assured users that the bug was fixed within a day and that there is no evidence that the information was used maliciously,"using,networks,download,information,tool,members,inadvertently,sent,phone,numbers,email,address,friends,otherwise,private,assured,users,bug,fixed,within,day,evidence,information,used,maliciously","using,network,download,information,tool,member,inadvertently,sent,phone,number,email,address,friend,otherwise,private,assured,user,bug,fixed,within,day,evidence,information,used,maliciously",using network download information tool member inadvertently sent phone number email address friend otherwise private assured user bug fixed within day evidence information used maliciously,"assured,maliciously,bug,fixed,inadvertently,day,friend,tool,download,sent,information,member,evidence,using,private,network,used,phone,user,email,address,number",tech,innovators,1.0,6000000.0,2.0,FB
vodafone,2000000,2013,An IT contractor for the firm used his deep access to the telecom giant's system to copy customer names and bank account details.,telecoms,technical,3.0,security week,http://www.securityweek.com/attacker-steals-data-2-million-vodafone-germany-customers,,3,Sep,2013-09-01,an it contractor for the firm used his deep access to the telecom giants system to copy customer names and bank account details,"contractor,firm,used,deep,access,telecom,giants,system,copy,customer,names,bank,account,details","contractor,firm,used,deep,access,telecom,giant,system,copy,customer,name,bank,account,detail",contractor firm used deep access telecom giant system copy customer name bank account detail,"deep,giant,copy,telecom,contractor,firm,bank,used,access,customer,account",infrastructure,integrity,100.0,200000000.0,4.0,VOD
adobe,36000000,2013,"Hackers obtained access to a large swathe of Adobe customer IDs and encrypted passwords & removed sensitive information (i.e. names, encrypted credit or debit card numbers, expiration dates, etc.). Approximately 36m customers: 3.1m stolen credit cards, 33m stolen encrypted passwords. Correction Jan 2015: we previously reported 152m records taken, but the remainder affected invalid, inactive, test accounts or had out-of-date passwords associated with them.",tech,technical,5.0,adobe,http://helpx.adobe.com/x-productkb/policy-pricing/customer-alert.html,,4,Oct,2013-10-01,hackers obtained access to a large swathe of adobe customer ids and encrypted passwords & removed sensitive information (ie names encrypted credit or debit card numbers expiration dates etc) approximately m customers: m stolen credit cards m stolen encrypted passwords correction jan : we previously reported m records taken but the remainder affected invalid inactive test accounts or had outofdate passwords associated with them,"hackers,obtained,access,large,swathe,customer,ids,encrypted,passwords,&,removed,sensitive,information,(ie,names,encrypted,credit,debit,card,numbers,expiration,dates,etc),approximately,customers:,stolen,credit,cards,stolen,encrypted,passwords,correction,jan,:,previously,reported,records,taken,remainder,affected,invalid,inactive,test,accounts,outofdate,passwords,associated","hacker,obtained,access,large,swathe,customer,id,encrypted,password,&,removed,sensitive,information,(ie,name,encrypted,credit,debit,card,number,expiration,date,etc),approximately,customers:,stolen,credit,card,stolen,encrypted,password,correction,jan,:,previously,reported,record,taken,remainder,affected,invalid,inactive,test,account,outofdate,password,associated","previously reported record taken remainder affected invalid inactive test account outofdate password associated,ie name encrypted credit debit card number expiration date etc,hacker obtained access large swathe customer id encrypted password,stolen credit card stolen encrypted password correction jan,removed sensitive information,approximately customers","encrypted,password,credit,card,inactive,invalid,outofdate,remainder,removed,swathe,correction,customers,expiration,jan,test,stolen,associated,large,approximately,obtained,reported,taken,debit,previously,sensitive,id,affected,access,date,customer,record,account,hacker,information,number",tech,innovators,10000.0,360000000000.0,7.0,ADBE
target,70000000,2013,Investigators believe the data was obtained via software installed on machines that customers use to swipe magnetic strips on their cards when paying for merchandise at Target stores. Originally 40m customers. Now 70m!,retail,technical,3.0,huffington post,http://www.huffingtonpost.com/2013/12/19/target-hacked-customer-credit-card-data-accessed_n_4471672.html?utm_hp_ref=mostpopular,,4,Dec,2013-12-01,investigators believe the data was obtained via software installed on machines that customers use to swipe magnetic strips on their cards when paying for merchandise at target stores originally m customers now m!,"investigators,believe,data,obtained,via,software,installed,machines,customers,use,swipe,magnetic,strips,cards,paying,merchandise,stores,originally,customers,m!","investigator,believe,data,obtained,via,software,installed,machine,customer,use,swipe,magnetic,strip,card,paying,merchandise,store,originally,customer,m!",investigator believe data obtained via software installed machine customer use swipe magnetic strip card paying merchandise store originally customer,"believe,machine,magnetic,merchandise,paying,strip,swipe,customer,installed,investigator,originally,obtained,use,store,software,card,data",retail,realworld,100.0,7000000000.0,5.0,TGT
global payments,7000000,2012,1.5 million credit card numbers from its systems may have been exposed after detecting “unauthorized access” into its processing system. ,financial,technical,3.0,washington post,http://www.washingtonpost.com/business/technology/faq-the-global-payments-hack/2012/04/02/gIQAIHLLrS_story.html,,3,Apr,2012-04-01, million credit card numbers from its systems may have been exposed after detecting “unauthorized access” into its processing system ,"million,credit,card,numbers,systems,may,exposed,detecting,“unauthorized,access”,processing,system","million,credit,card,number,system,may,exposed,detecting,“unauthorized,access”,processing,system",million credit card number system may exposed detecting “ unauthorized access ” processing system,"detecting,processing,unauthorized,exposed,access,credit,card,number,million",financial,integrity,100.0,700000000.0,4.0,GPN
dropbox,68000000,2012,"Dropbox acknowledged the breach at the time it occurred, but it didn't disclose the full extent of the hack.",web,technical,1.0,tech republic,https://www.techrepublic.com/article/2012-dropbox-hack-worse-than-realized-68m-passwords-leaked/,https://www.zdnet.com/article/dropbox-gets-hacked-again/,4,Aug,2012-08-01,dropbox acknowledged the breach at the time it occurred but it didnt disclose the full extent of the hack,"acknowledged,breach,time,occurred,didnt,disclose,full,extent,hack","acknowledged,breach,time,occurred,didnt,disclose,full,extent,hack",acknowledged breach time occurred didnt disclose full extent hack,"acknowledged,extent,occurred,didnt,disclose,time,hack,breach",tech,innovators,1.0,68000000.0,3.0,DBX
blizzard,14000000,2012,"Scrambled passwords, e-mail addresses, and personal security answers were knowingly stolen from Blizzard's internal network. Blizzard would not elaborate on the size of the hack (millions). ",gaming,technical,2.0,forbes,https://www.forbes.com/sites/erikkain/2012/08/09/its-official-blizzard-hacked-account-information-stolen/#6dfbcdc355d1,,4,Aug,2012-08-01,scrambled passwords email addresses and personal security answers were knowingly stolen from blizzards internal network blizzard would not elaborate on the size of the hack (millions) ,"scrambled,passwords,email,addresses,personal,security,answers,knowingly,stolen,blizzards,internal,network,would,elaborate,size,hack,(millions)","scrambled,password,email,address,personal,security,answer,knowingly,stolen,blizzard,internal,network,would,elaborate,size,hack,(millions)","scrambled password email address personal security answer knowingly stolen blizzard internal network would elaborate size hack,millions","blizzard,elaborate,knowingly,millions,answer,scrambled,size,internal,network,hack,personal,password,email,stolen,security,address",entertainment,innovators,10.0,140000000.0,4.0,ATVI
kt corp,8700000,2012,"Two suspects reportedly earnt an estimated $877,000 by selling the contact information and plan details of 8.7 million KT subscribers, almost half of the carrier's total customers.",telecoms,technical,2.0,korea times,http://www.koreatimes.co.kr/www/news/biz/2012/07/113_116143.html,http://news.cnet.com/8301-1009_3-57482215-83/hackers-accused-of-stealing-data-from-9m-korean-mobile-users/,3,Jul,2012-07-01,two suspects reportedly earnt an estimated $ by selling the contact information and plan details of  million kt subscribers almost half of the carriers total customers,"two,suspects,reportedly,earnt,estimated,$,selling,contact,information,plan,details,million,kt,subscribers,almost,half,carriers,total,customers","two,suspect,reportedly,earnt,estimated,$,selling,contact,information,plan,detail,million,kt,subscriber,almost,half,carrier,total,customer","selling contact information plan detail million kt subscriber almost half carrier total customer,two suspect reportedly earnt estimated","carrier,earnt,kt,reportedly,estimated,suspect,total,half,plan,subscriber,contact,selling,customer,information,million",infrastructure,integrity,10.0,87000000.0,3.0,KT
apple,12367232,2012,"Hacking group AntiSec claimed they hacked an FBI laptop in March 2012 accessing a file of more than 12 million Apple Unique Device Identifiers (UDIDs). Subsequently, it was discovered that app developer BlueToad was the source of the breach. The list contained personal information such as full names, phone numbers and addresses. AntiSec published a million of these UDIDs online.","tech, retail",human,2.0,cnet,http://news.cnet.com/8301-1009_3-57505330-83/antisec-claims-to-have-snatched-12m-apple-device-ids-from-fbi/,http://news.cnet.com/8301-1009_3-57509595-83/udid-leak-source-idd-bluetoad-mobile-firm-says-it-was-hacked/,4,Mar,2012-03-01,hacking group antisec claimed they hacked an fbi laptop in march  accessing a file of more than  million apple unique device identifiers (udids) subsequently it was discovered that app developer bluetoad was the source of the breach the list contained personal information such as full names phone numbers and addresses antisec published a million of these udids online,"hacking,group,antisec,claimed,hacked,fbi,laptop,march,accessing,file,million,unique,device,identifiers,(udids),subsequently,discovered,app,developer,bluetoad,source,breach,list,contained,personal,information,full,names,phone,numbers,addresses,antisec,published,million,udids,online","hacking,group,antisec,claimed,hacked,fbi,laptop,march,accessing,file,million,unique,device,identifier,(udids),subsequently,discovered,app,developer,bluetoad,source,breach,list,contained,personal,information,full,name,phone,number,address,antisec,published,million,udids,online","subsequently discovered app developer bluetoad source breach list contained personal information full name phone number address antisec published million udids online,hacking group antisec claimed hacked fbi laptop march accessing file million unique device identifier,udids","udids,antisec,bluetoad,fbi,subsequently,accessing,identifier,source,unique,claimed,device,list,march,app,developer,group,discovered,published,million,hacking,laptop,contained,file,breach,phone,online,hacked,personal,information,address,number",tech,innovators,10.0,123672320.0,4.0,AAPL
epsilon,3000000,2011,"Names & email addresses of customers of Barclaycard US, Capital One, JP Morgan, Citigroup & other firms have been stolen. ",web,technical,1.0,guardian,https://www.theguardian.com/technology/2011/apr/04/epsilon-email-hack,,3,Apr,2011-04-01,names & email addresses of customers of barclaycard us capital one jp morgan citigroup & other firms have been stolen ,"names,&,email,addresses,customers,barclaycard,us,capital,one,jp,morgan,&,firms,stolen","name,&,email,address,customer,barclaycard,u,capital,one,jp,morgan,&,firm,stolen","email address customer barclaycard u capital one jp morgan,firm stolen,name","barclaycard,capital,jp,morgan,firm,customer,email,stolen,address",tech,innovators,1.0,3000000.0,2.0,EPSN
citigroup,360083,2011,"Less than 1% of Citbank card holders' names, account numbers, and contact information such as e-mail addresses were stolen. Card security codes were not stolen. ",financial,technical,3.0,pc world,http://www.pcworld.com/article/229891/Citigroup_Hack_Nets_Over_200k_in_Stolen_Customer_Details.html,,2,Jun,2011-06-01,less than % of citbank card holders names account numbers and contact information such as email addresses were stolen card security codes were not stolen ,"less,%,citbank,card,holders,names,account,numbers,contact,information,email,addresses,stolen,card,security,codes,stolen","le,%,citbank,card,holder,name,account,number,contact,information,email,address,stolen,card,security,code,stolen","citbank card holder name account number contact information email address stolen card security code stolen,le","card,citbank,holder,le,stolen,contact,code,account,email,security,information,address,number",financial,integrity,100.0,36008300.0,3.0,C
nhs,8600000,2011,A laptop holding the unencrypted records of eight million patients went missing from an NHS store room and wasn't reported until 3 weeks later. ,healthcare,human,4.0,alphr,https://www.alphr.com/news/security/368062/nhs-loses-laptop-holding-8m-patient-records,,3,Jun,2011-06-01,a laptop holding the unencrypted records of eight million patients went missing from an nhs store room and wasnt reported until  weeks later ,"laptop,holding,unencrypted,records,eight,million,patients,went,missing,store,room,wasnt,reported,weeks,later","laptop,holding,unencrypted,record,eight,million,patient,went,missing,store,room,wasnt,reported,week,later",laptop holding unencrypted record eight million patient went missing store room wasnt reported week later,"holding,room,wasnt,later,missing,unencrypted,week,went,reported,store,laptop,patient,record,million",healthcare,integrity,1000.0,8600000000.0,5.0,NHS
att,114000,2010,"Details of iPad 3G users hacked from AT&T website, thought to include those of White House chief of staff Rahm Emanuel.",telecoms,technical,1.0,guardian,http://www.guardian.co.uk/technology/2010/jun/10/apple-ipad-security-leak?INTCMP=SRCH,,2,Jun,2010-06-01,details of ipad g users hacked from at&t website thought to include those of white house chief of staff rahm emanuel,"details,ipad,g,users,hacked,at&t,website,thought,include,white,house,chief,staff,rahm,emanuel","detail,ipad,g,user,hacked,at&t,website,thought,include,white,house,chief,staff,rahm,emanuel","website thought include white house chief staff rahm emanuel,detail ipad g user hacked","emanuel,house,ipad,rahm,white,chief,thought,staff,include,website,hacked,user",infrastructure,integrity,1.0,114000.0,1.0,ATIS
heartland,130000000,2009,"The biggest credit card scam in history, Heartland eventually paid more than $110 million to Visa, MasterCard, American Express and other card associations to settle claims related to the breach. A hacker was sentenced to 20 years in prison for his role in this & other cases.",financial,technical,3.0,dark reading,https://www.darkreading.com/attacks-and-breaches/heartland-payment-systems-hit-by-data-security-breach/d/d-id/1075770,,5,Jan,2009-01-01,the biggest credit card scam in history heartland eventually paid more than $ million to visa mastercard american express and other card associations to settle claims related to the breach a hacker was sentenced to  years in prison for his role in this & other cases,"biggest,credit,card,scam,history,eventually,paid,$,million,visa,mastercard,american,express,card,associations,settle,claims,related,breach,hacker,sentenced,years,prison,role,&,cases","biggest,credit,card,scam,history,eventually,paid,$,million,visa,mastercard,american,express,card,association,settle,claim,related,breach,hacker,sentenced,year,prison,role,&,case","million visa mastercard american express card association settle claim related breach hacker sentenced year prison role,biggest credit card scam history eventually paid,case","card,eventually,express,role,scam,association,mastercard,paid,settle,visa,american,prison,related,sentenced,biggest,history,case,claim,year,breach,credit,hacker,million",financial,integrity,100.0,13000000000.0,6.0,HTLD
att,113000,2008,"A laptop was stolen from a car containing unencrypted Social
Security numbers and bonus/salary info of AT&T employees.",telecoms,human,1.0,networkworld,https://www.networkworld.com/article/2344552/security/latest--lost--laptop-holds-treasure-trove-of-unencrypted-at-t-payroll-data.html,,2,Jun,2008-06-01,"a laptop was stolen from a car containing unencrypted social
security numbers and bonus/salary info of at&t employees","laptop,stolen,car,containing,unencrypted,social,security,numbers,bonus/salary,info,at&t,employees","laptop,stolen,car,containing,unencrypted,social,security,number,bonus/salary,info,at&t,employee","laptop stolen car containing unencrypted social security number bonus,salary info,employee","bonus,car,salary,unencrypted,laptop,info,employee,containing,social,stolen,security,number",infrastructure,integrity,1.0,113000.0,1.0,ATIS
starbucks,97000,2008,"A laptop was stolen that contained private information on 97,000 employees, including names, addresses and Social Security numbers. Employees tried to sue Starbucks in California winning their case in the appeals court before losing in the higher federal court as they were unable to prove any cognizable harm or injury.",retail,human,2.0,info watch,https://infowatch.com/analytics/leaks_monitoring/1304,,1,Nov,2008-11-01,a laptop was stolen that contained private information on  employees including names addresses and social security numbers employees tried to sue starbucks in california winning their case in the appeals court before losing in the higher federal court as they were unable to prove any cognizable harm or injury,"laptop,stolen,contained,private,information,employees,including,names,addresses,social,security,numbers,employees,tried,sue,california,winning,case,appeals,court,losing,higher,federal,court,unable,prove,cognizable,harm,injury","laptop,stolen,contained,private,information,employee,including,name,address,social,security,number,employee,tried,sue,california,winning,case,appeal,court,losing,higher,federal,court,unable,prove,cognizable,harm,injury",laptop stolen contained private information employee including name address social security number employee tried sue california winning case appeal court losing higher federal court unable prove cognizable harm injury,"court,employee,appeal,cognizable,harm,higher,injury,losing,sue,unable,winning,federal,prove,california,tried,case,private,laptop,contained,including,social,stolen,security,information,address,number",retail,realworld,10.0,970000.0,1.0,SBUX
