entity,records_lost,year,story,domain,method,sensitivity,source,link1,link2,records_lost_bins,month,date,story_clean,story_no_stopwords,story_no_stopwords_lem,rake,tdidf_ranked,org_type,business_type,sensitivity_log,severity,severity_bins,symbol
monster,1600000,2007,"A trojan virus stole log-ins that were used to harvest user names, e-mail addresses, home addresses and phone numbers. Soon after phishing e-mails encouraged users to download a Monster Job Seeker Tool, which was in fact a program that encrypted files in their computer and left a ransom note demanding money for their decryption.

",web,technical,2.0,bbc news,http://news.bbc.co.uk/1/hi/6956349.stm,,3,Aug,2007-08-01,"a trojan virus stole logins that were used to harvest user names email addresses home addresses and phone numbers soon after phishing emails encouraged users to download a monster job seeker tool which was in fact a program that encrypted files in their computer and left a ransom note demanding money for their decryption

","trojan,virus,stole,logins,used,harvest,user,names,email,addresses,home,addresses,phone,numbers,soon,phishing,emails,encouraged,users,download,job,seeker,tool,fact,program,encrypted,files,computer,left,ransom,note,demanding,money,decryption","trojan,virus,stole,logins,used,harvest,user,name,email,address,home,address,phone,number,soon,phishing,email,encouraged,user,download,job,seeker,tool,fact,program,encrypted,file,computer,left,ransom,note,demanding,money,decryption",trojan virus stole logins used harvest user name email address home address phone number soon phishing email encouraged user download job seeker tool fact program encrypted file computer left ransom note demanding money decryption,"decryption,encouraged,fact,harvest,note,phishing,seeker,trojan,user,demanding,logins,money,email,job,soon,virus,program,ransom,tool,download,left,address,home,encrypted,file,stole,used,computer,phone,number",tech,innovators,10.0,16000000.0,3.0,MNST
fidelity national information services,8500000,2007,"Employee sold customer information to a data broker, including names, addresses, birth dates, bank account and credit card information.",financial,technical,3.0,pcworld,http://www.pcworld.com/article/135117/article.html,,3,Jul,2007-07-01,employee sold customer information to a data broker including names addresses birth dates bank account and credit card information,"employee,sold,customer,information,data,broker,including,names,addresses,birth,dates,bank,account,credit,card,information","employee,sold,customer,information,data,broker,including,name,address,birth,date,bank,account,credit,card,information",employee sold customer information data broker including name address birth date bank account credit card information,"broker,sold,information,bank,employee,birth,credit,including,date,card,customer,account,address,data",financial,integrity,100.0,850000000.0,4.0,FIS
gap,800000,2007,"Stolen laptop which contained social security numbers, data on people who applied for positions at Gap stores, including Banana Republic and Old Navy, between July 2006 and June 2007.",retail,human,2.0,pc world,http://www.pcworld.com/article/137865/article.html,,2,Sep,2007-09-01,stolen laptop which contained social security numbers data on people who applied for positions at gap stores including banana republic and old navy between july  and june ,"stolen,laptop,contained,social,security,numbers,data,people,applied,positions,stores,including,banana,republic,old,navy,july,june","stolen,laptop,contained,social,security,number,data,people,applied,position,store,including,banana,republic,old,navy,july,june",stolen laptop contained social security number data people applied position store including banana republic old navy july june,"banana,navy,position,republic,applied,june,july,old,store,laptop,people,contained,including,social,stolen,security,number,data",retail,realworld,10.0,8000000.0,2.0,GPS
td ameritrade,6300000,2007,TD Ameritrade settled a class action lawsuit to compensate as many as 6.3 million TD Ameritrade customers whose data was stolen by hackers costing the Nebraska online brokerage firm less than $2 per victim.,financial,technical,1.0,wired,http://www.wired.com/threatlevel/2008/07/ameritrade-hack/,https://www.cnbc.com/id/20775257,3,Sep,2007-09-01,td ameritrade settled a class action lawsuit to compensate as many as  million td ameritrade customers whose data was stolen by hackers costing the nebraska online brokerage firm less than $ per victim,"td,settled,class,action,lawsuit,compensate,many,million,td,customers,whose,data,stolen,hackers,costing,nebraska,online,brokerage,firm,less,$,per,victim","td,settled,class,action,lawsuit,compensate,many,million,td,customer,whose,data,stolen,hacker,costing,nebraska,online,brokerage,firm,le,$,per,victim","td settled class action lawsuit compensate many million td customer whose data stolen hacker costing nebraska online brokerage firm le,per victim","td,brokerage,compensate,costing,nebraska,settled,class,victim,action,lawsuit,le,firm,online,customer,stolen,hacker,million,data",financial,integrity,1.0,6300000.0,2.0,AMTD
automatic data processing,125000,2006,"Automatic Data Processing, one of the world's largest payroll service companies, confirmed that it was swindled by a data thief looking for information on hundreds of thousands of American investors.",financial,human,2.0,abc news,http://abcnews.go.com/Technology/story?id=2160425&page=1#.UFcROxgUwaA,,2,Jul,2006-07-01,automatic data processing one of the worlds largest payroll service companies confirmed that it was swindled by a data thief looking for information on hundreds of thousands of american investors,"automatic,data,processing,one,worlds,largest,payroll,service,companies,confirmed,swindled,data,thief,looking,information,hundreds,thousands,american,investors","automatic,data,processing,one,world,largest,payroll,service,company,confirmed,swindled,data,thief,looking,information,hundred,thousand,american,investor",automatic data processing one world largest payroll service company confirmed swindled data thief looking information hundred thousand american investor,"automatic,payroll,swindled,investor,looking,american,processing,largest,thief,world,confirmed,data,thousand,service,company,information",financial,integrity,10.0,1250000.0,2.0,ADP
hewlett packard,200000,2006,"Laptop lost/stolen containing employee data: names, addresses, Social Security numbers, dates of birth and other employment-related information.","tech, retail",human,2.0,computer weekly,https://www.computerweekly.com/news/2240076956/Personal-data-on-200000-HP-employees-stolen,,2,Mar,2006-03-01,laptop lost/stolen containing employee data: names addresses social security numbers dates of birth and other employmentrelated information,"laptop,lost/stolen,containing,employee,data:,names,addresses,social,security,numbers,dates,birth,employmentrelated,information","laptop,lost/stolen,containing,employee,data:,name,address,social,security,number,date,birth,employmentrelated,information","name address social security number date birth employmentrelated information,stolen containing employee data,laptop lost","employmentrelated,laptop,lost,employee,containing,birth,date,social,stolen,security,information,address,number,data",tech,innovators,10.0,2000000.0,2.0,HPQ
ameritrade,200000,2005,Computer backup tape containing personal information was lost. ,financial,human,2.0,nbc,http://www.nbcnews.com/id/7561268/,,2,Apr,2005-04-01,computer backup tape containing personal information was lost ,"computer,backup,tape,containing,personal,information,lost","computer,backup,tape,containing,personal,information,lost",computer backup tape containing personal information lost,"backup,tape,lost,computer,containing,personal,information",financial,integrity,10.0,2000000.0,2.0,AMTD
citigroup,3900000,2005,Blame the messenger! A box of computer tapes containing information on 3.9 million customers was lost by United Parcel Service (UPS) while in transit to a credit reporting agency.,financial,human,3.0,ny times,http://www.nytimes.com/2005/06/07/business/07data.html?pagewanted=all&_moc.semityn.www,,3,Jun,2005-06-01,blame the messenger! a box of computer tapes containing information on  million customers was lost by united parcel service (ups) while in transit to a credit reporting agency,"blame,messenger!,box,computer,tapes,containing,information,million,customers,lost,united,parcel,service,(ups),transit,credit,reporting,agency","blame,messenger!,box,computer,tape,containing,information,million,customer,lost,united,parcel,service,(ups),transit,credit,reporting,agency","box computer tape containing information million customer lost united parcel service,transit credit reporting agency,blame messenger,ups","blame,box,messenger,parcel,ups,reporting,united,transit,agency,tape,service,lost,computer,containing,credit,customer,information,million",financial,integrity,100.0,390000000.0,4.0,C
